{
  "meta": {
    "date": "2026-06-09",
    "title": "李自在AI 日报",
    "collectedAt": "2026-06-09 07:10"
  },
  "overview": {
    "summary": "每日精选 AI 行业热点，一文速览前沿动态",
    "keywords": [
      "WWDC 2026",
      "Siri AI",
      "微信AI",
      "Apple Foundation Models",
      "OpenAI IPO",
      "开源Agent"
    ],
    "boxes": [
      {
        "label": "热点话题",
        "text": "Apple WWDC 2026 开幕，发布全新 Siri AI 独立 App，基于 Gemini 驱动实现个人上下文理解、屏幕感知和联网搜索三大能力，同时推出第三代 Apple Foundation Models 并首次支持第三方 AI 模型接入，标志着苹果 AI 战略的重大转折"
      },
      {
        "label": "AI+教育 赛道信号",
        "text": "Apple Foundation Models 框架全面支持 Swift 开发者接入设备端 AI 能力，教育类 App 可直接调用端侧大模型实现个性化辅导、智能批改等功能，降低 AI 教育产品开发门槛"
      },
      {
        "label": "独立开发者关注",
        "text": "Apple Foundation Models + Claude Swift 包的组合为 iOS 开发者打开了端侧 AI 应用的大门；微信 AI 生态的自动模式允许零代码接入 AI 能力；GitHub Trending 上 AI Agent 技能/插件生态持续爆发"
      }
    ]
  },
  "headline": {
    "summary": "今日 AI 领域迎来多重重磅事件：Apple WWDC 2026 以 AI 为绝对核心发布全新 Siri 和 Apple Intelligence 生态；微信开放 AI 生态接入能力，首批企业已接入测试；OpenAI 正式向 SEC 提交机密上市文件。模型层面，小米 MiMo 联合 TileRT 突破 1000 tokens/s 推理速度，高德发布全球首个 3D 原生城市世界模型。NVIDIA 与 SK Hynix 签署多年协议共推下一代 AI 存储芯片。这些动态共同指向一个趋势：AI 正从「模型竞赛」转向「生态落地」，对独立开发者而言是能力红利期。",
    "source": "Apple Newsroom / IT之家 / 微信公开课 / Bloomberg / The Decoder / 新浪财经 / 36kr"
  },
  "news": [
    {
      "title": "Apple WWDC 2026：Siri AI 独立成 App，Gemini 驱动全面重构",
      "source": "Apple Newsroom",
      "keyPoints": "Apple 在 WWDC 2026 发布全新 Siri AI，具备三大核心能力——个人上下文理解（跨消息、邮件、照片搜索个人信息）、屏幕感知（识别屏幕内容并回答相关问题）、联网世界知识搜索。Siri 首次成为独立 App，支持对话历史回顾和跨设备 iCloud 同步。底层由 Google Gemini 驱动，运行于苹果私有云，强化隐私保护。同时推出第三代 Apple Foundation Models，开发者可通过 Swift API 直接接入设备端模型。",
      "analysis": "这是苹果 AI 战略的真正转折点。Siri AI 的独立 App 化意味着苹果从「语音助手」进化为「AI 助手」，而 Foundation Models 框架的开放为独立开发者打开了端侧 AI 应用的大门。对独立开发者而言，这是 iOS 生态自 App Store 以来最大的平台能力扩展，建议立即关注 Swift Foundation Models API。",
      "url": "https://developer.apple.com/newsroom/"
    },
    {
      "title": "微信 AI 生态正式开放：自动模式零代码接入，京东首批内测",
      "source": "每日经济新闻",
      "keyPoints": "6 月 8 日，微信开放平台正式发布《关于开发者接入微信 AI 生态的指引》，提供两种接入模式：自动模式（授权平台读取小程序源码，AI 直接操作页面，无需额外开发）和开发模式（开发者基于 API 自定义 AI 能力）。两种模式可同时开启。京东作为首批内测企业接入电商、外卖、物流业务。",
      "analysis": "微信 AI 的开放对独立开发者意义重大。自动模式允许零代码让小程序具备 AI Agent 能力，开发模式则提供深度定制空间。这意味着微信生态中的 400 万+小程序都将有机会接入 AI，覆盖 13 亿月活用户。",
      "url": "https://www.nbd.com.cn/"
    },
    {
      "title": "OpenAI 向 SEC 机密提交 S-1 草案，AI 巨头上市竞速开启",
      "source": "OpenAI 官网动态",
      "keyPoints": "OpenAI 已向美国证券交易委员会（SEC）机密提交 S-1 上市注册草案，具体上市时间未定。此前 Anthropic 已于 6 月 1 日提交机密 IPO 文件，估值达 9650 亿美元。两家 AI 巨头有望在今年秋天先后登陆公开市场，形成 AI 行业史上最大规模的 IPO 竞速。",
      "analysis": "OpenAI 和 Anthropic 的 IPO 竞速将重塑 AI 行业格局。上市意味着更透明的财务数据、更开放的平台策略，以及更活跃的生态投资。建议关注两家公司的 S-1 文件中对开发者生态和 API 定价的表述。",
      "url": "https://openai.com/blog/"
    },
    {
      "title": "小米 MiMo-V2.5-Pro UltraSpeed 突破 1000 tokens/s",
      "source": "IT之家",
      "keyPoints": "小米 MiMo 官方与 TileRT 联合发布 MiMo-V2.5-Pro 的 UltraSpeed 模式，通过模型与系统的极致协同设计，在通用 GPU 上将万亿参数 MoE 模型的生成速度首次突破 1000 tokens/s。单台 8-GPU 节点即可运行 1T 参数模型。",
      "analysis": "1000 tokens/s 的推理速度意味着实时对话延迟降至毫秒级。对独立开发者而言，这种推理效率的突破直接降低了 AI 应用的运营成本，使得低延迟、高并发的 AI 产品成为可能。",
      "url": "https://www.ithome.com/"
    },
    {
      "title": "高德发布全球首个 3D 原生城市世界模型 ABot-Earth0.5",
      "source": "新浪财经",
      "keyPoints": "阿里巴巴旗下高德发布全球首个 3D 原生城市世界模型 ABot-Earth0.5，已建成覆盖 190 多个国家和地区的 3D 地图。用户输入一张卫星图像或文字描述，系统仅需 10 分钟即可在消费级 GPU 上生成公里级 3D 城市场景。",
      "analysis": "ABot-Earth0.5 将 3D 城市场景生成从「手工作坊」升级为「自动化工厂」。为游戏开发、AR/VR 应用、智慧城市可视化等领域提供了前所未有的低成本 3D 内容生成能力。",
      "url": "https://finance.sina.com.cn/"
    },
    {
      "title": "NVIDIA 与 SK Hynix 签署多年协议，共推下一代 AI 存储芯片",
      "source": "Bloomberg Technology",
      "keyPoints": "NVIDIA 与 SK Hynix 宣布建立多年期技术合作伙伴关系，围绕 Vera Rubin AI 超级计算机、RTX Spark PC 和 Jetson Thor 机器人平台联合开发专用内存。合作涵盖 AI 基础设施、个人 AI 和物理 AI 三大新市场。",
      "analysis": "AI 训练和推理的瓶颈正在从计算转向存储。NVIDIA 与 SK Hynix 的深度绑定意味着下一代 AI 硬件将实现计算-存储的协同优化，本地运行大模型的硬件条件将持续改善。",
      "url": "https://www.bloomberg.com/technology"
    }
  ],
  "openSource": {
    "summary": "今日 GitHub Trending 的 AI 项目呈现出三大趋势：一是 AI Agent 技能/插件生态的爆发，以 last30days-skill（日增 3558 星）和 Google 官方 Skills 为代表；二是 AI 记忆系统的成熟，MemPalace 以 5.4 万星位居记忆系统榜首；三是本地 LLM 优化工具链的完善，turbovec 和 whichllm 分别从向量检索和模型选型两个维度降低本地部署门槛。",
    "highlight": "last30days-skill 项目值得关注——它将多源信息采集与 AI 综合摘要结合，本质上是一个轻量级的「AI 研究 Agent」。这种「信息采集 + AI 综合」的模式可复用于市场调研、竞品分析、投资研究等多个商业场景。",
    "source": "GitHub Trending + Web 搜索",
    "items": [
      {
        "name": "last30days-skill",
        "repo": "https://github.com/mvanhorn/last30days-skill",
        "stars": 34394,
        "starsToday": 3558,
        "description": "跨平台 AI 研究代理技能，能自动从 Reddit、X(Twitter)、YouTube、Hacker News、Polymarket 及网页等多个信息源采集指定主题的内容，并利用 AI 生成有依据的综合摘要报告。",
        "tags": [
          "AI Agent",
          "信息采集",
          "研究工具"
        ],
        "devValue": "可落地场景：构建行业情报 SaaS、打造投资研究工具。集成难度：Python 项目，pip install 即可。商业化潜力：MIT 协议无限制，可包装为订阅制情报服务。",
        "source": "GitHub Trending"
      },
      {
        "name": "MemPalace",
        "repo": "https://github.com/MemPalace/mempalace",
        "stars": 54903,
        "starsToday": 237,
        "description": "基准测试表现最佳的开源 AI 记忆系统，为 AI Agent 提供持久化的记忆管理能力。与主流 LLM 框架深度集成，支持语义检索、时间衰减和重要性排序等多维记忆管理策略。",
        "tags": [
          "AI Agent",
          "记忆系统",
          "RAG"
        ],
        "devValue": "可落地场景：为 AI 客服产品添加长期用户记忆、构建个人知识管理工具。集成难度：Python SDK，支持 LangChain/LlamaIndex 插件式集成。",
        "source": "GitHub Trending"
      },
      {
        "name": "turbovec",
        "repo": "https://github.com/RyanCodrai/turbovec",
        "stars": 8770,
        "starsToday": 1730,
        "description": "基于 TurboQuant 构建的高性能向量索引库，核心引擎用 Rust 编写并提供 Python 绑定。针对 AI/ML 场景中的大规模向量检索进行了极致优化。",
        "tags": [
          "向量检索",
          "RAG 框架",
          "Rust"
        ],
        "devValue": "可落地场景：为 RAG 应用提供高性能向量检索层、构建图像/音频相似度检索 API。集成难度：Python bindings 开箱即用。",
        "source": "GitHub Trending"
      },
      {
        "name": "Goose",
        "repo": "https://github.com/aaif-goose/goose",
        "stars": 48074,
        "starsToday": 699,
        "description": "开源可扩展的 AI Agent 开发框架，超越代码补全范畴，支持安装、执行、编辑和测试全流程自动化。可搭配任意 LLM 使用，采用 Rust 编写确保高性能。",
        "tags": [
          "AI Agent",
          "开发工具",
          "自动化"
        ],
        "devValue": "可落地场景：构建团队级 AI 编码助手、打造垂直领域自动化工作流平台。集成难度：Rust 编译需要环境配置，但提供预编译二进制文件。",
        "source": "GitHub Trending"
      },
      {
        "name": "CopilotKit",
        "repo": "https://github.com/CopilotKit/CopilotKit",
        "stars": 34107,
        "starsToday": 398,
        "description": "面向 AI Agent 和生成式 UI 的前端技术栈，作为 AG-UI 协议的创建者，定义了 AI Agent 与前端交互的标准范式。提供完整的组件库和 SDK。",
        "tags": [
          "AI Agent",
          "前端框架",
          "开发工具"
        ],
        "devValue": "可落地场景：快速构建 AI 驱动的 SaaS 产品前端、为现有产品添加 AI Copilot 功能。集成难度：React 组件开箱即用。",
        "source": "GitHub Trending"
      },
      {
        "name": "career-ops",
        "repo": "https://github.com/santifer/career-ops",
        "stars": 50465,
        "starsToday": 477,
        "description": "基于 Claude Code 构建的 AI 驱动求职系统，支持 14 种技能模式（简历优化、面试模拟、薪资谈判等），Go 语言编写的仪表盘提供数据可视化。",
        "tags": [
          "AI Agent",
          "职业工具",
          "Claude Code"
        ],
        "devValue": "可落地场景：构建垂直领域的人才服务平台、参考技能模式设计其他工作流 AI 工具。集成难度：基于 Claude Code，需要 API Key。",
        "source": "GitHub Trending"
      }
    ]
  },
  "modelsAndProducts": {
    "summary": "本日模型与产品动态亮点密集：Apple 发布第三代 AFM 并支持第三方模型接入，小米 MiMo 推理速度突破 1000 tokens/s，高德推出全球首个 3D 原生城市世界模型，Claude 推出 Apple Foundation Models 的 Swift 包，微信 AI 开放小程序接入。",
    "source": "Apple ML Research / IT之家 / HuggingFace Blog / Claude Blog / 微信公开课 / OpenRouter",
    "foreign": [
      {
        "project": "Apple Foundation Models (AFM)",
        "update": "发布第三代 AFM，支持开发者通过 Swift API 接入设备端模型",
        "highlight": "首次支持第三方 AI 模型接入，端侧推理无需网络",
        "source": "Apple ML Research"
      },
      {
        "project": "Claude Swift Package",
        "update": "Claude 推出支持 Apple Foundation Models 框架的新 Swift 包",
        "highlight": "开发者可在 iOS App 中直接集成 Claude 能力",
        "source": "Claude Blog"
      },
      {
        "project": "ChatGPT 数据图表",
        "update": "ChatGPT 新增数据图表生成功能",
        "highlight": "支持从对话中直接生成可视化图表",
        "source": "@ChatGPTapp"
      },
      {
        "project": "NotebookLM 升级",
        "update": "NotebookLM 重大升级：智能体能力与高级推理",
        "highlight": "引入 Agent 能力，可自主搜索、整理和分析",
        "source": "@NotebookLM"
      },
      {
        "project": "Runway Aleph 2.0 API",
        "update": "Aleph 2.0 视频编辑模型正式上线 API",
        "highlight": "支持编辑现有视频并保持一致性",
        "source": "Runway API Docs"
      },
      {
        "project": "Viggle API",
        "update": "Viggle API 上线，任意角色任意动作秒级生成",
        "highlight": "视频动作迁移技术的商业化落地",
        "source": "@ViggleAI"
      }
    ],
    "domestic": [
      {
        "project": "微信 AI 生态",
        "update": "正式开放小程序 AI 接入，自动模式+开发模式双轨并行",
        "highlight": "零代码接入降低门槛，京东首批内测",
        "source": "微信公开课"
      },
      {
        "project": "小米 MiMo UltraSpeed",
        "update": "MiMO-V2.5-Pro 联合 TileRT 突破 1000 tokens/s",
        "highlight": "万亿参数 MoE 模型在通用 GPU 上实现千 token 推理速度",
        "source": "IT之家"
      },
      {
        "project": "高德 ABot-Earth0.5",
        "update": "发布全球首个 3D 原生城市世界模型",
        "highlight": "10 分钟消费级 GPU 生成公里级 3D 城市",
        "source": "新浪财经"
      },
      {
        "project": "面壁智能 VoxCPM2",
        "update": "VoxCPM2 技术报告发布，20 亿参数语音大模型",
        "highlight": "支持 30 种语言 + 9 种中文方言",
        "source": "OpenBMB"
      },
      {
        "project": "Kimi Code",
        "update": "Kimi Code 焕新升级，附视频教程",
        "highlight": "月之暗面的 AI 编码工具新版本发布",
        "source": "公众号：月之暗面"
      }
    ]
  },
  "companyUpdates": {
    "summary": "本日厂商动态聚焦 Apple WWDC 2026 带来的生态变化、NVIDIA 的存储芯片合作、以及 OpenAI 的上市进程。",
    "source": "Apple Newsroom / Bloomberg / The Decoder / IT之家 / 36kr / 新浪财经",